Timing is on.

=========================================
Simple FK Index Testing
=========================================

TRUNCATE TABLE
Time: 21.886 ms
CREATE FUNCTION
Time: 4.131 ms
Function created

psql:/tmp/test_all_fk_simple.sql:160: NOTICE:  Testing 119 foreign keys...
psql:/tmp/test_all_fk_simple.sql:160: NOTICE:  
psql:/tmp/test_all_fk_simple.sql:160: NOTICE:  ========================================
psql:/tmp/test_all_fk_simple.sql:160: NOTICE:  Test 1/119: xhbm_container_entity_history.container_entity (12 MB)
psql:/tmp/test_all_fk_simple.sql:160: NOTICE:  ========================================
psql:/tmp/test_all_fk_simple.sql:160: NOTICE:  Baseline: 11.6540000000000000.2f ms
psql:/tmp/test_all_fk_simple.sql:160: NOTICE:  Index created
psql:/tmp/test_all_fk_simple.sql:160: NOTICE:  With index: 4.9226000000000000.2f ms
psql:/tmp/test_all_fk_simple.sql:160: NOTICE:  KEEP - improved by 57.76.2f%
psql:/tmp/test_all_fk_simple.sql:160: NOTICE:  
psql:/tmp/test_all_fk_simple.sql:160: NOTICE:  ========================================
psql:/tmp/test_all_fk_simple.sql:160: NOTICE:  Test 2/119: xhbm_container_entity.parent_container_entity (5824 kB)
psql:/tmp/test_all_fk_simple.sql:160: NOTICE:  ========================================
psql:/tmp/test_all_fk_simple.sql:160: NOTICE:  Baseline: 3.3326000000000000.2f ms
psql:/tmp/test_all_fk_simple.sql:160: NOTICE:  Index created
psql:/tmp/test_all_fk_simple.sql:160: NOTICE:  With index: 0.30740000000000000000.2f ms
psql:/tmp/test_all_fk_simple.sql:160: NOTICE:  KEEP - improved by 90.78.2f%
psql:/tmp/test_all_fk_simple.sql:160: NOTICE:  
psql:/tmp/test_all_fk_simple.sql:160: NOTICE:  ========================================
psql:/tmp/test_all_fk_simple.sql:160: NOTICE:  Test 3/119: xhbm_container_entity_mount.container_entity (4952 kB)
psql:/tmp/test_all_fk_simple.sql:160: NOTICE:  ========================================
psql:/tmp/test_all_fk_simple.sql:160: NOTICE:  Baseline: 3.5562000000000000.2f ms
psql:/tmp/test_all_fk_simple.sql:160: NOTICE:  Index created
psql:/tmp/test_all_fk_simple.sql:160: NOTICE:  With index: 2.2072000000000000.2f ms
psql:/tmp/test_all_fk_simple.sql:160: NOTICE:  KEEP - improved by 37.93.2f%
psql:/tmp/test_all_fk_simple.sql:160: NOTICE:  
psql:/tmp/test_all_fk_simple.sql:160: NOTICE:  ========================================
psql:/tmp/test_all_fk_simple.sql:160: NOTICE:  Test 4/119: xhbm_container_entity_output.container_entity (2392 kB)
psql:/tmp/test_all_fk_simple.sql:160: NOTICE:  ========================================
psql:/tmp/test_all_fk_simple.sql:160: NOTICE:  Baseline: 2.7792000000000000.2f ms
psql:/tmp/test_all_fk_simple.sql:160: NOTICE:  Index created
psql:/tmp/test_all_fk_simple.sql:160: NOTICE:  With index: 1.5116000000000000.2f ms
psql:/tmp/test_all_fk_simple.sql:160: NOTICE:  KEEP - improved by 45.61.2f%
psql:/tmp/test_all_fk_simple.sql:160: NOTICE:  
psql:/tmp/test_all_fk_simple.sql:160: NOTICE:  ========================================
psql:/tmp/test_all_fk_simple.sql:160: NOTICE:  Test 5/119: xhbm_timed_event_status_entity.subscription_delivery_entity (488 kB)
psql:/tmp/test_all_fk_simple.sql:160: NOTICE:  ========================================
psql:/tmp/test_all_fk_simple.sql:160: NOTICE:  Baseline: 0.90840000000000000000.2f ms
psql:/tmp/test_all_fk_simple.sql:160: NOTICE:  Index created
psql:/tmp/test_all_fk_simple.sql:160: NOTICE:  With index: 0.71120000000000000000.2f ms
psql:/tmp/test_all_fk_simple.sql:160: NOTICE:  KEEP - improved by 21.71.2f%
psql:/tmp/test_all_fk_simple.sql:160: NOTICE:  
psql:/tmp/test_all_fk_simple.sql:160: NOTICE:  ========================================
psql:/tmp/test_all_fk_simple.sql:160: NOTICE:  Test 6/119: xhbm_subscription_delivery_entity.subscription (288 kB)
psql:/tmp/test_all_fk_simple.sql:160: NOTICE:  ========================================
psql:/tmp/test_all_fk_simple.sql:160: NOTICE:  Baseline: 0.47020000000000000000.2f ms
psql:/tmp/test_all_fk_simple.sql:160: NOTICE:  Index created
psql:/tmp/test_all_fk_simple.sql:160: NOTICE:  With index: 0.30920000000000000000.2f ms
psql:/tmp/test_all_fk_simple.sql:160: NOTICE:  KEEP - improved by 34.24.2f%
psql:/tmp/test_all_fk_simple.sql:160: NOTICE:  
psql:/tmp/test_all_fk_simple.sql:160: NOTICE:  ========================================
psql:/tmp/test_all_fk_simple.sql:160: NOTICE:  Test 7/119: xhbm_subscription_delivery_entity.triggering_event_entity (288 kB)
psql:/tmp/test_all_fk_simple.sql:160: NOTICE:  ========================================
psql:/tmp/test_all_fk_simple.sql:160: NOTICE:  Baseline: 0.27300000000000000000.2f ms
psql:/tmp/test_all_fk_simple.sql:160: NOTICE:  Index created
psql:/tmp/test_all_fk_simple.sql:160: NOTICE:  With index: 0.32820000000000000000.2f ms
psql:/tmp/test_all_fk_simple.sql:160: NOTICE:  ROLLBACK - only improved by -20.22.2f%
psql:/tmp/test_all_fk_simple.sql:160: NOTICE:  
psql:/tmp/test_all_fk_simple.sql:160: NOTICE:  ========================================
psql:/tmp/test_all_fk_simple.sql:160: NOTICE:  Test 8/119: xnat_experimentdata.visit (272 kB)
psql:/tmp/test_all_fk_simple.sql:160: NOTICE:  ========================================
psql:/tmp/test_all_fk_simple.sql:160: NOTICE:  Baseline: 1.7286000000000000.2f ms
psql:/tmp/test_all_fk_simple.sql:160: NOTICE:  Index created
psql:/tmp/test_all_fk_simple.sql:160: NOTICE:  With index: 0.35460000000000000000.2f ms
psql:/tmp/test_all_fk_simple.sql:160: NOTICE:  KEEP - improved by 79.49.2f%
psql:/tmp/test_all_fk_simple.sql:160: NOTICE:  
psql:/tmp/test_all_fk_simple.sql:160: NOTICE:  ========================================
psql:/tmp/test_all_fk_simple.sql:160: NOTICE:  Test 9/119: xhbm_automation_event_ids_ids.parent_automation_event_ids (216 kB)
psql:/tmp/test_all_fk_simple.sql:160: NOTICE:  ========================================
psql:/tmp/test_all_fk_simple.sql:160: NOTICE:  Baseline: 0.62420000000000000000.2f ms
psql:/tmp/test_all_fk_simple.sql:160: NOTICE:  Index created
psql:/tmp/test_all_fk_simple.sql:160: NOTICE:  With index: 0.34720000000000000000.2f ms
psql:/tmp/test_all_fk_simple.sql:160: NOTICE:  KEEP - improved by 44.38.2f%
psql:/tmp/test_all_fk_simple.sql:160: NOTICE:  
psql:/tmp/test_all_fk_simple.sql:160: NOTICE:  ========================================
psql:/tmp/test_all_fk_simple.sql:160: NOTICE:  Test 10/119: icr_roicollectiondata.subjectid (160 kB)
psql:/tmp/test_all_fk_simple.sql:160: NOTICE:  ========================================
psql:/tmp/test_all_fk_simple.sql:160: NOTICE:  Baseline: 0.87920000000000000000.2f ms
psql:/tmp/test_all_fk_simple.sql:160: NOTICE:  Index created
psql:/tmp/test_all_fk_simple.sql:160: NOTICE:  With index: 0.26920000000000000000.2f ms
psql:/tmp/test_all_fk_simple.sql:160: NOTICE:  KEEP - improved by 69.38.2f%
psql:/tmp/test_all_fk_simple.sql:160: NOTICE:  
psql:/tmp/test_all_fk_simple.sql:160: NOTICE:  ========================================
psql:/tmp/test_all_fk_simple.sql:160: NOTICE:  Test 11/119: xhbm_configuration.config_data (160 kB)
psql:/tmp/test_all_fk_simple.sql:160: NOTICE:  ========================================
psql:/tmp/test_all_fk_simple.sql:160: NOTICE:  Baseline: 0.42720000000000000000.2f ms
psql:/tmp/test_all_fk_simple.sql:160: NOTICE:  Index created
psql:/tmp/test_all_fk_simple.sql:160: NOTICE:  With index: 0.26460000000000000000.2f ms
psql:/tmp/test_all_fk_simple.sql:160: NOTICE:  KEEP - improved by 38.06.2f%
psql:/tmp/test_all_fk_simple.sql:160: NOTICE:  
psql:/tmp/test_all_fk_simple.sql:160: NOTICE:  ========================================
psql:/tmp/test_all_fk_simple.sql:160: NOTICE:  Test 12/119: xnat_subjectassessordata.subject_id (120 kB)
psql:/tmp/test_all_fk_simple.sql:160: NOTICE:  ========================================
psql:/tmp/test_all_fk_simple.sql:160: NOTICE:  Baseline: 0.92220000000000000000.2f ms
psql:/tmp/test_all_fk_simple.sql:160: NOTICE:  Index created
psql:/tmp/test_all_fk_simple.sql:160: NOTICE:  With index: 0.36200000000000000000.2f ms
psql:/tmp/test_all_fk_simple.sql:160: NOTICE:  KEEP - improved by 60.75.2f%
psql:/tmp/test_all_fk_simple.sql:160: NOTICE:  
psql:/tmp/test_all_fk_simple.sql:160: NOTICE:  ========================================
psql:/tmp/test_all_fk_simple.sql:160: NOTICE:  Test 13/119: xhbm_event_service_filter_entity_project_ids.event_service_filter_entity (112 kB)
psql:/tmp/test_all_fk_simple.sql:160: NOTICE:  ========================================
psql:/tmp/test_all_fk_simple.sql:160: NOTICE:  Baseline: 0.71300000000000000000.2f ms
psql:/tmp/test_all_fk_simple.sql:160: NOTICE:  Index created
psql:/tmp/test_all_fk_simple.sql:160: NOTICE:  With index: 0.33540000000000000000.2f ms
psql:/tmp/test_all_fk_simple.sql:160: NOTICE:  KEEP - improved by 52.96.2f%
psql:/tmp/test_all_fk_simple.sql:160: NOTICE:  
psql:/tmp/test_all_fk_simple.sql:160: NOTICE:  ========================================
psql:/tmp/test_all_fk_simple.sql:160: NOTICE:  Test 14/119: xnat_experimentdata_resource.xnat_abstractresource_xnat_abstractresource_id (104 kB)
psql:/tmp/test_all_fk_simple.sql:160: NOTICE:  ========================================
psql:/tmp/test_all_fk_simple.sql:160: NOTICE:  Baseline: 0.60900000000000000000.2f ms
psql:/tmp/test_all_fk_simple.sql:160: NOTICE:  Index created
psql:/tmp/test_all_fk_simple.sql:160: NOTICE:  With index: 0.34140000000000000000.2f ms
psql:/tmp/test_all_fk_simple.sql:160: NOTICE:  KEEP - improved by 43.94.2f%
psql:/tmp/test_all_fk_simple.sql:160: NOTICE:  
psql:/tmp/test_all_fk_simple.sql:160: NOTICE:  ========================================
psql:/tmp/test_all_fk_simple.sql:160: NOTICE:  Test 15/119: xnat_experimentdata_resource.xnat_experimentdata_id (104 kB)
psql:/tmp/test_all_fk_simple.sql:160: NOTICE:  ========================================
psql:/tmp/test_all_fk_simple.sql:160: NOTICE:  Baseline: 0.25360000000000000000.2f ms
psql:/tmp/test_all_fk_simple.sql:160: NOTICE:  Index created
psql:/tmp/test_all_fk_simple.sql:160: NOTICE:  With index: 0.32420000000000000000.2f ms
psql:/tmp/test_all_fk_simple.sql:160: NOTICE:  ROLLBACK - only improved by -27.84.2f%
psql:/tmp/test_all_fk_simple.sql:160: NOTICE:  
psql:/tmp/test_all_fk_simple.sql:160: NOTICE:  ========================================
psql:/tmp/test_all_fk_simple.sql:160: NOTICE:  Test 16/119: img_assessor_out_resource.xnat_abstractresource_xnat_abstractresource_id (72 kB)
psql:/tmp/test_all_fk_simple.sql:160: NOTICE:  ========================================
psql:/tmp/test_all_fk_simple.sql:160: NOTICE:  Baseline: 0.39860000000000000000.2f ms
psql:/tmp/test_all_fk_simple.sql:160: NOTICE:  Index created
psql:/tmp/test_all_fk_simple.sql:160: NOTICE:  With index: 0.27060000000000000000.2f ms
psql:/tmp/test_all_fk_simple.sql:160: NOTICE:  KEEP - improved by 32.11.2f%
psql:/tmp/test_all_fk_simple.sql:160: NOTICE:  
psql:/tmp/test_all_fk_simple.sql:160: NOTICE:  ========================================
psql:/tmp/test_all_fk_simple.sql:160: NOTICE:  Test 17/119: img_assessor_out_resource.xnat_imageassessordata_id (72 kB)
psql:/tmp/test_all_fk_simple.sql:160: NOTICE:  ========================================
psql:/tmp/test_all_fk_simple.sql:160: NOTICE:  Baseline: 0.33000000000000000000.2f ms
psql:/tmp/test_all_fk_simple.sql:160: NOTICE:  Index created
psql:/tmp/test_all_fk_simple.sql:160: NOTICE:  With index: 0.27680000000000000000.2f ms
psql:/tmp/test_all_fk_simple.sql:160: NOTICE:  KEEP - improved by 16.12.2f%
psql:/tmp/test_all_fk_simple.sql:160: NOTICE:  
psql:/tmp/test_all_fk_simple.sql:160: NOTICE:  ========================================
psql:/tmp/test_all_fk_simple.sql:160: NOTICE:  Test 18/119: xnat_imageassessordata.imagesession_id (40 kB)
psql:/tmp/test_all_fk_simple.sql:160: NOTICE:  ========================================
psql:/tmp/test_all_fk_simple.sql:160: NOTICE:  Baseline: 1.01860000000000000000.2f ms
psql:/tmp/test_all_fk_simple.sql:160: NOTICE:  Index created
psql:/tmp/test_all_fk_simple.sql:160: NOTICE:  With index: 0.24020000000000000000.2f ms
psql:/tmp/test_all_fk_simple.sql:160: NOTICE:  KEEP - improved by 76.42.2f%
psql:/tmp/test_all_fk_simple.sql:160: NOTICE:  
psql:/tmp/test_all_fk_simple.sql:160: NOTICE:  ========================================
psql:/tmp/test_all_fk_simple.sql:160: NOTICE:  Test 19/119: xhbm_automation_filters_values.automation_filters (16 kB)
psql:/tmp/test_all_fk_simple.sql:160: NOTICE:  ========================================
psql:/tmp/test_all_fk_simple.sql:160: NOTICE:  Baseline: 0.47420000000000000000.2f ms
psql:/tmp/test_all_fk_simple.sql:160: NOTICE:  Index created
psql:/tmp/test_all_fk_simple.sql:160: NOTICE:  With index: 0.26800000000000000000.2f ms
psql:/tmp/test_all_fk_simple.sql:160: NOTICE:  KEEP - improved by 43.48.2f%
psql:/tmp/test_all_fk_simple.sql:160: NOTICE:  
psql:/tmp/test_all_fk_simple.sql:160: NOTICE:  ========================================
psql:/tmp/test_all_fk_simple.sql:160: NOTICE:  Test 20/119: xhbm_command_input_entity.command_entity (16 kB)
psql:/tmp/test_all_fk_simple.sql:160: NOTICE:  ========================================
psql:/tmp/test_all_fk_simple.sql:160: NOTICE:  Baseline: 0.79120000000000000000.2f ms
psql:/tmp/test_all_fk_simple.sql:160: NOTICE:  Index created
psql:/tmp/test_all_fk_simple.sql:160: NOTICE:  With index: 0.22260000000000000000.2f ms
psql:/tmp/test_all_fk_simple.sql:160: NOTICE:  KEEP - improved by 71.87.2f%
psql:/tmp/test_all_fk_simple.sql:160: NOTICE:  
DO
Time: 1381.859 ms (00:01.382)

=========================================
SUMMARY
=========================================

 tables_tested | indexes_tested | kept | rolled_back | errors | avg_improvement_pct 
---------------+----------------+------+-------------+--------+---------------------
            17 |             20 |   18 |           2 |      0 |               50.94
(1 row)

Time: 11.884 ms

--- KEPT INDEXES (>= 5% improvement) ---
                  table_name                  |   index_name   | improvement_pct 
----------------------------------------------+----------------+-----------------
 xhbm_container_entity                        | idx_test_fk_2  |           90.78
 xnat_experimentdata                          | idx_test_fk_8  |           79.49
 xnat_imageassessordata                       | idx_test_fk_18 |           76.42
 xhbm_command_input_entity                    | idx_test_fk_20 |           71.87
 icr_roicollectiondata                        | idx_test_fk_10 |           69.38
 xnat_subjectassessordata                     | idx_test_fk_12 |           60.75
 xhbm_container_entity_history                | idx_test_fk_1  |           57.76
 xhbm_event_service_filter_entity_project_ids | idx_test_fk_13 |           52.96
 xhbm_container_entity_output                 | idx_test_fk_4  |           45.61
 xhbm_automation_event_ids_ids                | idx_test_fk_9  |           44.38
 xnat_experimentdata_resource                 | idx_test_fk_14 |           43.94
 xhbm_automation_filters_values               | idx_test_fk_19 |           43.48
 xhbm_configuration                           | idx_test_fk_11 |           38.06
 xhbm_container_entity_mount                  | idx_test_fk_3  |           37.93
 xhbm_subscription_delivery_entity            | idx_test_fk_6  |           34.24
 img_assessor_out_resource                    | idx_test_fk_16 |           32.11
 xhbm_timed_event_status_entity               | idx_test_fk_5  |           21.71
 img_assessor_out_resource                    | idx_test_fk_17 |           16.12
(18 rows)

Time: 1.358 ms

--- ROLLED BACK (<5% improvement) ---
            table_name             |   index_name   | improvement_pct 
-----------------------------------+----------------+-----------------
 xhbm_subscription_delivery_entity | idx_test_fk_7  |          -20.22
 xnat_experimentdata_resource      | idx_test_fk_15 |          -27.84
(2 rows)

Time: 0.538 ms

--- ERRORS ---
 table_name | index_name | notes 
------------+------------+-------
(0 rows)

Time: 0.434 ms
psql:/tmp/test_all_fk_simple.sql:218: NOTICE:  Dropped: idx_test_fk_1
psql:/tmp/test_all_fk_simple.sql:218: NOTICE:  Dropped: idx_test_fk_10
psql:/tmp/test_all_fk_simple.sql:218: NOTICE:  Dropped: idx_test_fk_11
psql:/tmp/test_all_fk_simple.sql:218: NOTICE:  Dropped: idx_test_fk_12
psql:/tmp/test_all_fk_simple.sql:218: NOTICE:  Dropped: idx_test_fk_13
psql:/tmp/test_all_fk_simple.sql:218: NOTICE:  Dropped: idx_test_fk_14
psql:/tmp/test_all_fk_simple.sql:218: NOTICE:  Dropped: idx_test_fk_16
psql:/tmp/test_all_fk_simple.sql:218: NOTICE:  Dropped: idx_test_fk_17
psql:/tmp/test_all_fk_simple.sql:218: NOTICE:  Dropped: idx_test_fk_18
psql:/tmp/test_all_fk_simple.sql:218: NOTICE:  Dropped: idx_test_fk_19
psql:/tmp/test_all_fk_simple.sql:218: NOTICE:  Dropped: idx_test_fk_2
psql:/tmp/test_all_fk_simple.sql:218: NOTICE:  Dropped: idx_test_fk_20
psql:/tmp/test_all_fk_simple.sql:218: NOTICE:  Dropped: idx_test_fk_3
psql:/tmp/test_all_fk_simple.sql:218: NOTICE:  Dropped: idx_test_fk_4
psql:/tmp/test_all_fk_simple.sql:218: NOTICE:  Dropped: idx_test_fk_5
psql:/tmp/test_all_fk_simple.sql:218: NOTICE:  Dropped: idx_test_fk_6
psql:/tmp/test_all_fk_simple.sql:218: NOTICE:  Dropped: idx_test_fk_8
psql:/tmp/test_all_fk_simple.sql:218: NOTICE:  Dropped: idx_test_fk_9
DO
Time: 68.421 ms

All test indexes cleaned up
Results saved in pg_index_test_log table

