Timing is on.

=========================================
Simple FK Index Testing
=========================================

TRUNCATE TABLE
Time: 11.954 ms
CREATE FUNCTION
Time: 5.702 ms
Function created

psql:/tmp/test_all_fk_simple.sql:160: NOTICE:  Testing 119 foreign keys...
psql:/tmp/test_all_fk_simple.sql:160: NOTICE:  
psql:/tmp/test_all_fk_simple.sql:160: NOTICE:  ========================================
psql:/tmp/test_all_fk_simple.sql:160: NOTICE:  Test 1/119: xhbm_container_entity_history.container_entity (12 MB)
psql:/tmp/test_all_fk_simple.sql:160: NOTICE:  ========================================
psql:/tmp/test_all_fk_simple.sql:160: NOTICE:  Baseline: 11.7220000000000000.2f ms
psql:/tmp/test_all_fk_simple.sql:160: NOTICE:  Index created
psql:/tmp/test_all_fk_simple.sql:160: NOTICE:  With index: 5.5290000000000000.2f ms
psql:/tmp/test_all_fk_simple.sql:160: NOTICE:  KEEP - improved by 52.83.2f%
psql:/tmp/test_all_fk_simple.sql:160: NOTICE:  
psql:/tmp/test_all_fk_simple.sql:160: NOTICE:  ========================================
psql:/tmp/test_all_fk_simple.sql:160: NOTICE:  Test 2/119: xhbm_container_entity.parent_container_entity (5824 kB)
psql:/tmp/test_all_fk_simple.sql:160: NOTICE:  ========================================
psql:/tmp/test_all_fk_simple.sql:160: NOTICE:  Baseline: 3.9032000000000000.2f ms
psql:/tmp/test_all_fk_simple.sql:160: NOTICE:  Index created
psql:/tmp/test_all_fk_simple.sql:160: NOTICE:  With index: 0.26760000000000000000.2f ms
psql:/tmp/test_all_fk_simple.sql:160: NOTICE:  KEEP - improved by 93.14.2f%
psql:/tmp/test_all_fk_simple.sql:160: NOTICE:  
psql:/tmp/test_all_fk_simple.sql:160: NOTICE:  ========================================
psql:/tmp/test_all_fk_simple.sql:160: NOTICE:  Test 3/119: xhbm_container_entity_mount.container_entity (4952 kB)
psql:/tmp/test_all_fk_simple.sql:160: NOTICE:  ========================================
psql:/tmp/test_all_fk_simple.sql:160: NOTICE:  Baseline: 4.5458000000000000.2f ms
psql:/tmp/test_all_fk_simple.sql:160: NOTICE:  Index created
psql:/tmp/test_all_fk_simple.sql:160: NOTICE:  With index: 2.8858000000000000.2f ms
psql:/tmp/test_all_fk_simple.sql:160: NOTICE:  KEEP - improved by 36.52.2f%
psql:/tmp/test_all_fk_simple.sql:160: NOTICE:  
psql:/tmp/test_all_fk_simple.sql:160: NOTICE:  ========================================
psql:/tmp/test_all_fk_simple.sql:160: NOTICE:  Test 4/119: xhbm_container_entity_output.container_entity (2392 kB)
psql:/tmp/test_all_fk_simple.sql:160: NOTICE:  ========================================
psql:/tmp/test_all_fk_simple.sql:160: NOTICE:  Baseline: 2.6304000000000000.2f ms
psql:/tmp/test_all_fk_simple.sql:160: NOTICE:  Index created
psql:/tmp/test_all_fk_simple.sql:160: NOTICE:  With index: 2.1306000000000000.2f ms
psql:/tmp/test_all_fk_simple.sql:160: NOTICE:  KEEP - improved by 19.00.2f%
psql:/tmp/test_all_fk_simple.sql:160: NOTICE:  
psql:/tmp/test_all_fk_simple.sql:160: NOTICE:  ========================================
psql:/tmp/test_all_fk_simple.sql:160: NOTICE:  Test 5/119: xhbm_timed_event_status_entity.subscription_delivery_entity (488 kB)
psql:/tmp/test_all_fk_simple.sql:160: NOTICE:  ========================================
psql:/tmp/test_all_fk_simple.sql:160: NOTICE:  Baseline: 2.5616000000000000.2f ms
psql:/tmp/test_all_fk_simple.sql:160: NOTICE:  Index created
psql:/tmp/test_all_fk_simple.sql:160: NOTICE:  With index: 0.80720000000000000000.2f ms
psql:/tmp/test_all_fk_simple.sql:160: NOTICE:  KEEP - improved by 68.49.2f%
psql:/tmp/test_all_fk_simple.sql:160: NOTICE:  
psql:/tmp/test_all_fk_simple.sql:160: NOTICE:  ========================================
psql:/tmp/test_all_fk_simple.sql:160: NOTICE:  Test 6/119: xhbm_subscription_delivery_entity.subscription (288 kB)
psql:/tmp/test_all_fk_simple.sql:160: NOTICE:  ========================================
psql:/tmp/test_all_fk_simple.sql:160: NOTICE:  Baseline: 1.18420000000000000000.2f ms
psql:/tmp/test_all_fk_simple.sql:160: NOTICE:  Index created
psql:/tmp/test_all_fk_simple.sql:160: NOTICE:  With index: 0.34500000000000000000.2f ms
psql:/tmp/test_all_fk_simple.sql:160: NOTICE:  KEEP - improved by 70.87.2f%
psql:/tmp/test_all_fk_simple.sql:160: NOTICE:  
psql:/tmp/test_all_fk_simple.sql:160: NOTICE:  ========================================
psql:/tmp/test_all_fk_simple.sql:160: NOTICE:  Test 7/119: xhbm_subscription_delivery_entity.triggering_event_entity (288 kB)
psql:/tmp/test_all_fk_simple.sql:160: NOTICE:  ========================================
psql:/tmp/test_all_fk_simple.sql:160: NOTICE:  Baseline: 0.30420000000000000000.2f ms
psql:/tmp/test_all_fk_simple.sql:160: NOTICE:  Index created
psql:/tmp/test_all_fk_simple.sql:160: NOTICE:  With index: 0.42280000000000000000.2f ms
psql:/tmp/test_all_fk_simple.sql:160: NOTICE:  ROLLBACK - only improved by -38.99.2f%
psql:/tmp/test_all_fk_simple.sql:160: NOTICE:  
psql:/tmp/test_all_fk_simple.sql:160: NOTICE:  ========================================
psql:/tmp/test_all_fk_simple.sql:160: NOTICE:  Test 8/119: xnat_experimentdata.visit (272 kB)
psql:/tmp/test_all_fk_simple.sql:160: NOTICE:  ========================================
psql:/tmp/test_all_fk_simple.sql:160: NOTICE:  Baseline: 3.4410000000000000.2f ms
psql:/tmp/test_all_fk_simple.sql:160: NOTICE:  Index created
psql:/tmp/test_all_fk_simple.sql:160: NOTICE:  With index: 0.31520000000000000000.2f ms
psql:/tmp/test_all_fk_simple.sql:160: NOTICE:  KEEP - improved by 90.84.2f%
psql:/tmp/test_all_fk_simple.sql:160: NOTICE:  
psql:/tmp/test_all_fk_simple.sql:160: NOTICE:  ========================================
psql:/tmp/test_all_fk_simple.sql:160: NOTICE:  Test 9/119: xhbm_automation_event_ids_ids.parent_automation_event_ids (216 kB)
psql:/tmp/test_all_fk_simple.sql:160: NOTICE:  ========================================
psql:/tmp/test_all_fk_simple.sql:160: NOTICE:  Baseline: 0.99460000000000000000.2f ms
psql:/tmp/test_all_fk_simple.sql:160: NOTICE:  Index created
psql:/tmp/test_all_fk_simple.sql:160: NOTICE:  With index: 0.62780000000000000000.2f ms
psql:/tmp/test_all_fk_simple.sql:160: NOTICE:  KEEP - improved by 36.88.2f%
psql:/tmp/test_all_fk_simple.sql:160: NOTICE:  
psql:/tmp/test_all_fk_simple.sql:160: NOTICE:  ========================================
psql:/tmp/test_all_fk_simple.sql:160: NOTICE:  Test 10/119: icr_roicollectiondata.subjectid (160 kB)
psql:/tmp/test_all_fk_simple.sql:160: NOTICE:  ========================================
psql:/tmp/test_all_fk_simple.sql:160: NOTICE:  Baseline: 1.4446000000000000.2f ms
psql:/tmp/test_all_fk_simple.sql:160: NOTICE:  Index created
psql:/tmp/test_all_fk_simple.sql:160: NOTICE:  With index: 0.25880000000000000000.2f ms
psql:/tmp/test_all_fk_simple.sql:160: NOTICE:  KEEP - improved by 82.09.2f%
psql:/tmp/test_all_fk_simple.sql:160: NOTICE:  
psql:/tmp/test_all_fk_simple.sql:160: NOTICE:  ========================================
psql:/tmp/test_all_fk_simple.sql:160: NOTICE:  Test 11/119: xhbm_configuration.config_data (160 kB)
psql:/tmp/test_all_fk_simple.sql:160: NOTICE:  ========================================
psql:/tmp/test_all_fk_simple.sql:160: NOTICE:  Baseline: 0.50940000000000000000.2f ms
psql:/tmp/test_all_fk_simple.sql:160: NOTICE:  Index created
psql:/tmp/test_all_fk_simple.sql:160: NOTICE:  With index: 0.39780000000000000000.2f ms
psql:/tmp/test_all_fk_simple.sql:160: NOTICE:  KEEP - improved by 21.91.2f%
psql:/tmp/test_all_fk_simple.sql:160: NOTICE:  
psql:/tmp/test_all_fk_simple.sql:160: NOTICE:  ========================================
psql:/tmp/test_all_fk_simple.sql:160: NOTICE:  Test 12/119: xnat_subjectassessordata.subject_id (120 kB)
psql:/tmp/test_all_fk_simple.sql:160: NOTICE:  ========================================
psql:/tmp/test_all_fk_simple.sql:160: NOTICE:  Baseline: 1.2956000000000000.2f ms
psql:/tmp/test_all_fk_simple.sql:160: NOTICE:  Index created
psql:/tmp/test_all_fk_simple.sql:160: NOTICE:  With index: 0.34240000000000000000.2f ms
psql:/tmp/test_all_fk_simple.sql:160: NOTICE:  KEEP - improved by 73.57.2f%
psql:/tmp/test_all_fk_simple.sql:160: NOTICE:  
psql:/tmp/test_all_fk_simple.sql:160: NOTICE:  ========================================
psql:/tmp/test_all_fk_simple.sql:160: NOTICE:  Test 13/119: xhbm_event_service_filter_entity_project_ids.event_service_filter_entity (112 kB)
psql:/tmp/test_all_fk_simple.sql:160: NOTICE:  ========================================
psql:/tmp/test_all_fk_simple.sql:160: NOTICE:  Baseline: 0.45280000000000000000.2f ms
psql:/tmp/test_all_fk_simple.sql:160: NOTICE:  Index created
psql:/tmp/test_all_fk_simple.sql:160: NOTICE:  With index: 0.33760000000000000000.2f ms
psql:/tmp/test_all_fk_simple.sql:160: NOTICE:  KEEP - improved by 25.44.2f%
psql:/tmp/test_all_fk_simple.sql:160: NOTICE:  
psql:/tmp/test_all_fk_simple.sql:160: NOTICE:  ========================================
psql:/tmp/test_all_fk_simple.sql:160: NOTICE:  Test 14/119: xnat_experimentdata_resource.xnat_abstractresource_xnat_abstractresource_id (104 kB)
psql:/tmp/test_all_fk_simple.sql:160: NOTICE:  ========================================
psql:/tmp/test_all_fk_simple.sql:160: NOTICE:  Baseline: 0.76240000000000000000.2f ms
psql:/tmp/test_all_fk_simple.sql:160: NOTICE:  Index created
psql:/tmp/test_all_fk_simple.sql:160: NOTICE:  With index: 0.36540000000000000000.2f ms
psql:/tmp/test_all_fk_simple.sql:160: NOTICE:  KEEP - improved by 52.07.2f%
psql:/tmp/test_all_fk_simple.sql:160: NOTICE:  
psql:/tmp/test_all_fk_simple.sql:160: NOTICE:  ========================================
psql:/tmp/test_all_fk_simple.sql:160: NOTICE:  Test 15/119: xnat_experimentdata_resource.xnat_experimentdata_id (104 kB)
psql:/tmp/test_all_fk_simple.sql:160: NOTICE:  ========================================
psql:/tmp/test_all_fk_simple.sql:160: NOTICE:  Baseline: 0.28900000000000000000.2f ms
psql:/tmp/test_all_fk_simple.sql:160: NOTICE:  Index created
psql:/tmp/test_all_fk_simple.sql:160: NOTICE:  With index: 0.33420000000000000000.2f ms
psql:/tmp/test_all_fk_simple.sql:160: NOTICE:  ROLLBACK - only improved by -15.64.2f%
psql:/tmp/test_all_fk_simple.sql:160: NOTICE:  
psql:/tmp/test_all_fk_simple.sql:160: NOTICE:  ========================================
psql:/tmp/test_all_fk_simple.sql:160: NOTICE:  Test 16/119: img_assessor_out_resource.xnat_abstractresource_xnat_abstractresource_id (72 kB)
psql:/tmp/test_all_fk_simple.sql:160: NOTICE:  ========================================
psql:/tmp/test_all_fk_simple.sql:160: NOTICE:  Baseline: 0.58460000000000000000.2f ms
psql:/tmp/test_all_fk_simple.sql:160: NOTICE:  Index created
psql:/tmp/test_all_fk_simple.sql:160: NOTICE:  With index: 0.28120000000000000000.2f ms
psql:/tmp/test_all_fk_simple.sql:160: NOTICE:  KEEP - improved by 51.90.2f%
psql:/tmp/test_all_fk_simple.sql:160: NOTICE:  
psql:/tmp/test_all_fk_simple.sql:160: NOTICE:  ========================================
psql:/tmp/test_all_fk_simple.sql:160: NOTICE:  Test 17/119: img_assessor_out_resource.xnat_imageassessordata_id (72 kB)
psql:/tmp/test_all_fk_simple.sql:160: NOTICE:  ========================================
psql:/tmp/test_all_fk_simple.sql:160: NOTICE:  Baseline: 0.28020000000000000000.2f ms
psql:/tmp/test_all_fk_simple.sql:160: NOTICE:  Index created
psql:/tmp/test_all_fk_simple.sql:160: NOTICE:  With index: 0.31080000000000000000.2f ms
psql:/tmp/test_all_fk_simple.sql:160: NOTICE:  ROLLBACK - only improved by -10.92.2f%
psql:/tmp/test_all_fk_simple.sql:160: NOTICE:  
psql:/tmp/test_all_fk_simple.sql:160: NOTICE:  ========================================
psql:/tmp/test_all_fk_simple.sql:160: NOTICE:  Test 18/119: xnat_imageassessordata.imagesession_id (40 kB)
psql:/tmp/test_all_fk_simple.sql:160: NOTICE:  ========================================
psql:/tmp/test_all_fk_simple.sql:160: NOTICE:  Baseline: 3.3276000000000000.2f ms
psql:/tmp/test_all_fk_simple.sql:160: NOTICE:  Index created
psql:/tmp/test_all_fk_simple.sql:160: NOTICE:  With index: 0.41140000000000000000.2f ms
psql:/tmp/test_all_fk_simple.sql:160: NOTICE:  KEEP - improved by 87.64.2f%
psql:/tmp/test_all_fk_simple.sql:160: NOTICE:  
psql:/tmp/test_all_fk_simple.sql:160: NOTICE:  ========================================
psql:/tmp/test_all_fk_simple.sql:160: NOTICE:  Test 19/119: xhbm_automation_filters_values.automation_filters (16 kB)
psql:/tmp/test_all_fk_simple.sql:160: NOTICE:  ========================================
psql:/tmp/test_all_fk_simple.sql:160: NOTICE:  Baseline: 0.26760000000000000000.2f ms
psql:/tmp/test_all_fk_simple.sql:160: NOTICE:  Index created
psql:/tmp/test_all_fk_simple.sql:160: NOTICE:  With index: 0.25920000000000000000.2f ms
psql:/tmp/test_all_fk_simple.sql:160: NOTICE:  ROLLBACK - only improved by 3.14.2f%
psql:/tmp/test_all_fk_simple.sql:160: NOTICE:  
psql:/tmp/test_all_fk_simple.sql:160: NOTICE:  ========================================
psql:/tmp/test_all_fk_simple.sql:160: NOTICE:  Test 20/119: xhbm_command_input_entity.command_entity (16 kB)
psql:/tmp/test_all_fk_simple.sql:160: NOTICE:  ========================================
psql:/tmp/test_all_fk_simple.sql:160: NOTICE:  Baseline: 0.48140000000000000000.2f ms
psql:/tmp/test_all_fk_simple.sql:160: NOTICE:  Index created
psql:/tmp/test_all_fk_simple.sql:160: NOTICE:  With index: 0.20680000000000000000.2f ms
psql:/tmp/test_all_fk_simple.sql:160: NOTICE:  KEEP - improved by 57.04.2f%
psql:/tmp/test_all_fk_simple.sql:160: NOTICE:  
DO
Time: 1483.251 ms (00:01.483)

=========================================
SUMMARY
=========================================

 tables_tested | indexes_tested | kept | rolled_back | errors | avg_improvement_pct 
---------------+----------------+------+-------------+--------+---------------------
            17 |             20 |   16 |           4 |      0 |               57.51
(1 row)

Time: 13.516 ms

--- KEPT INDEXES (>= 5% improvement) ---
                  table_name                  |   index_name   | improvement_pct 
----------------------------------------------+----------------+-----------------
 xhbm_container_entity                        | idx_test_fk_2  |           93.14
 xnat_experimentdata                          | idx_test_fk_8  |           90.84
 xnat_imageassessordata                       | idx_test_fk_18 |           87.64
 icr_roicollectiondata                        | idx_test_fk_10 |           82.09
 xnat_subjectassessordata                     | idx_test_fk_12 |           73.57
 xhbm_subscription_delivery_entity            | idx_test_fk_6  |           70.87
 xhbm_timed_event_status_entity               | idx_test_fk_5  |           68.49
 xhbm_command_input_entity                    | idx_test_fk_20 |           57.04
 xhbm_container_entity_history                | idx_test_fk_1  |           52.83
 xnat_experimentdata_resource                 | idx_test_fk_14 |           52.07
 img_assessor_out_resource                    | idx_test_fk_16 |           51.90
 xhbm_automation_event_ids_ids                | idx_test_fk_9  |           36.88
 xhbm_container_entity_mount                  | idx_test_fk_3  |           36.52
 xhbm_event_service_filter_entity_project_ids | idx_test_fk_13 |           25.44
 xhbm_configuration                           | idx_test_fk_11 |           21.91
 xhbm_container_entity_output                 | idx_test_fk_4  |           19.00
(16 rows)

Time: 0.915 ms

--- ROLLED BACK (<5% improvement) ---
            table_name             |   index_name   | improvement_pct 
-----------------------------------+----------------+-----------------
 xhbm_automation_filters_values    | idx_test_fk_19 |            3.14
 img_assessor_out_resource         | idx_test_fk_17 |          -10.92
 xnat_experimentdata_resource      | idx_test_fk_15 |          -15.64
 xhbm_subscription_delivery_entity | idx_test_fk_7  |          -38.99
(4 rows)

Time: 0.487 ms

--- ERRORS ---
 table_name | index_name | notes 
------------+------------+-------
(0 rows)

Time: 0.204 ms
psql:/tmp/test_all_fk_simple.sql:218: NOTICE:  Dropped: idx_test_fk_1
psql:/tmp/test_all_fk_simple.sql:218: NOTICE:  Dropped: idx_test_fk_10
psql:/tmp/test_all_fk_simple.sql:218: NOTICE:  Dropped: idx_test_fk_11
psql:/tmp/test_all_fk_simple.sql:218: NOTICE:  Dropped: idx_test_fk_12
psql:/tmp/test_all_fk_simple.sql:218: NOTICE:  Dropped: idx_test_fk_13
psql:/tmp/test_all_fk_simple.sql:218: NOTICE:  Dropped: idx_test_fk_14
psql:/tmp/test_all_fk_simple.sql:218: NOTICE:  Dropped: idx_test_fk_16
psql:/tmp/test_all_fk_simple.sql:218: NOTICE:  Dropped: idx_test_fk_18
psql:/tmp/test_all_fk_simple.sql:218: NOTICE:  Dropped: idx_test_fk_2
psql:/tmp/test_all_fk_simple.sql:218: NOTICE:  Dropped: idx_test_fk_20
psql:/tmp/test_all_fk_simple.sql:218: NOTICE:  Dropped: idx_test_fk_3
psql:/tmp/test_all_fk_simple.sql:218: NOTICE:  Dropped: idx_test_fk_4
psql:/tmp/test_all_fk_simple.sql:218: NOTICE:  Dropped: idx_test_fk_5
psql:/tmp/test_all_fk_simple.sql:218: NOTICE:  Dropped: idx_test_fk_6
psql:/tmp/test_all_fk_simple.sql:218: NOTICE:  Dropped: idx_test_fk_8
psql:/tmp/test_all_fk_simple.sql:218: NOTICE:  Dropped: idx_test_fk_9
DO
Time: 32.983 ms

All test indexes cleaned up
Results saved in pg_index_test_log table

