Timing is on.

=========================================
Simple FK Index Testing
=========================================

TRUNCATE TABLE
Time: 24.475 ms
CREATE FUNCTION
Time: 4.271 ms
Function created

psql:/tmp/test_all_fk_simple.sql:160: NOTICE:  Testing 120 foreign keys...
psql:/tmp/test_all_fk_simple.sql:160: NOTICE:  
psql:/tmp/test_all_fk_simple.sql:160: NOTICE:  ========================================
psql:/tmp/test_all_fk_simple.sql:160: NOTICE:  Test 1/120: xhbm_container_entity_history.container_entity (12 MB)
psql:/tmp/test_all_fk_simple.sql:160: NOTICE:  ========================================
psql:/tmp/test_all_fk_simple.sql:160: NOTICE:  Baseline: 15.8038000000000000.2f ms
psql:/tmp/test_all_fk_simple.sql:160: NOTICE:  Index created
psql:/tmp/test_all_fk_simple.sql:160: NOTICE:  With index: 7.2728000000000000.2f ms
psql:/tmp/test_all_fk_simple.sql:160: NOTICE:  KEEP - improved by 53.98.2f%
psql:/tmp/test_all_fk_simple.sql:160: NOTICE:  
psql:/tmp/test_all_fk_simple.sql:160: NOTICE:  ========================================
psql:/tmp/test_all_fk_simple.sql:160: NOTICE:  Test 2/120: xhbm_container_entity.parent_container_entity (5824 kB)
psql:/tmp/test_all_fk_simple.sql:160: NOTICE:  ========================================
psql:/tmp/test_all_fk_simple.sql:160: NOTICE:  Baseline: 3.8306000000000000.2f ms
psql:/tmp/test_all_fk_simple.sql:160: NOTICE:  Index created
psql:/tmp/test_all_fk_simple.sql:160: NOTICE:  With index: 0.34200000000000000000.2f ms
psql:/tmp/test_all_fk_simple.sql:160: NOTICE:  KEEP - improved by 91.07.2f%
psql:/tmp/test_all_fk_simple.sql:160: NOTICE:  
psql:/tmp/test_all_fk_simple.sql:160: NOTICE:  ========================================
psql:/tmp/test_all_fk_simple.sql:160: NOTICE:  Test 3/120: xhbm_container_entity_mount.container_entity (4952 kB)
psql:/tmp/test_all_fk_simple.sql:160: NOTICE:  ========================================
psql:/tmp/test_all_fk_simple.sql:160: NOTICE:  Baseline: 3.5018000000000000.2f ms
psql:/tmp/test_all_fk_simple.sql:160: NOTICE:  Index created
psql:/tmp/test_all_fk_simple.sql:160: NOTICE:  With index: 2.6944000000000000.2f ms
psql:/tmp/test_all_fk_simple.sql:160: NOTICE:  KEEP - improved by 23.06.2f%
psql:/tmp/test_all_fk_simple.sql:160: NOTICE:  
psql:/tmp/test_all_fk_simple.sql:160: NOTICE:  ========================================
psql:/tmp/test_all_fk_simple.sql:160: NOTICE:  Test 4/120: xhbm_container_entity_output.container_entity (2392 kB)
psql:/tmp/test_all_fk_simple.sql:160: NOTICE:  ========================================
psql:/tmp/test_all_fk_simple.sql:160: NOTICE:  Baseline: 2.4566000000000000.2f ms
psql:/tmp/test_all_fk_simple.sql:160: NOTICE:  Index created
psql:/tmp/test_all_fk_simple.sql:160: NOTICE:  With index: 1.6312000000000000.2f ms
psql:/tmp/test_all_fk_simple.sql:160: NOTICE:  KEEP - improved by 33.60.2f%
psql:/tmp/test_all_fk_simple.sql:160: NOTICE:  
psql:/tmp/test_all_fk_simple.sql:160: NOTICE:  ========================================
psql:/tmp/test_all_fk_simple.sql:160: NOTICE:  Test 5/120: xhbm_container_entity_log_paths.container_entity (1856 kB)
psql:/tmp/test_all_fk_simple.sql:160: NOTICE:  ========================================
psql:/tmp/test_all_fk_simple.sql:160: NOTICE:  Baseline: 1.6890000000000000.2f ms
psql:/tmp/test_all_fk_simple.sql:160: NOTICE:  Index created
psql:/tmp/test_all_fk_simple.sql:160: NOTICE:  With index: 1.3562000000000000.2f ms
psql:/tmp/test_all_fk_simple.sql:160: NOTICE:  KEEP - improved by 19.70.2f%
psql:/tmp/test_all_fk_simple.sql:160: NOTICE:  
psql:/tmp/test_all_fk_simple.sql:160: NOTICE:  ========================================
psql:/tmp/test_all_fk_simple.sql:160: NOTICE:  Test 6/120: xhbm_timed_event_status_entity.subscription_delivery_entity (488 kB)
psql:/tmp/test_all_fk_simple.sql:160: NOTICE:  ========================================
psql:/tmp/test_all_fk_simple.sql:160: NOTICE:  Baseline: 1.17560000000000000000.2f ms
psql:/tmp/test_all_fk_simple.sql:160: NOTICE:  Index created
psql:/tmp/test_all_fk_simple.sql:160: NOTICE:  With index: 0.81840000000000000000.2f ms
psql:/tmp/test_all_fk_simple.sql:160: NOTICE:  KEEP - improved by 30.38.2f%
psql:/tmp/test_all_fk_simple.sql:160: NOTICE:  
psql:/tmp/test_all_fk_simple.sql:160: NOTICE:  ========================================
psql:/tmp/test_all_fk_simple.sql:160: NOTICE:  Test 7/120: xhbm_subscription_delivery_entity.subscription (288 kB)
psql:/tmp/test_all_fk_simple.sql:160: NOTICE:  ========================================
psql:/tmp/test_all_fk_simple.sql:160: NOTICE:  Baseline: 0.83480000000000000000.2f ms
psql:/tmp/test_all_fk_simple.sql:160: NOTICE:  Index created
psql:/tmp/test_all_fk_simple.sql:160: NOTICE:  With index: 0.54120000000000000000.2f ms
psql:/tmp/test_all_fk_simple.sql:160: NOTICE:  KEEP - improved by 35.17.2f%
psql:/tmp/test_all_fk_simple.sql:160: NOTICE:  
psql:/tmp/test_all_fk_simple.sql:160: NOTICE:  ========================================
psql:/tmp/test_all_fk_simple.sql:160: NOTICE:  Test 8/120: xhbm_subscription_delivery_entity.triggering_event_entity (288 kB)
psql:/tmp/test_all_fk_simple.sql:160: NOTICE:  ========================================
psql:/tmp/test_all_fk_simple.sql:160: NOTICE:  Baseline: 0.33540000000000000000.2f ms
psql:/tmp/test_all_fk_simple.sql:160: NOTICE:  Index created
psql:/tmp/test_all_fk_simple.sql:160: NOTICE:  With index: 0.47120000000000000000.2f ms
psql:/tmp/test_all_fk_simple.sql:160: NOTICE:  ROLLBACK - only improved by -40.49.2f%
psql:/tmp/test_all_fk_simple.sql:160: NOTICE:  
psql:/tmp/test_all_fk_simple.sql:160: NOTICE:  ========================================
psql:/tmp/test_all_fk_simple.sql:160: NOTICE:  Test 9/120: xnat_experimentdata.visit (272 kB)
psql:/tmp/test_all_fk_simple.sql:160: NOTICE:  ========================================
psql:/tmp/test_all_fk_simple.sql:160: NOTICE:  Baseline: 1.8102000000000000.2f ms
psql:/tmp/test_all_fk_simple.sql:160: NOTICE:  Index created
psql:/tmp/test_all_fk_simple.sql:160: NOTICE:  With index: 0.52900000000000000000.2f ms
psql:/tmp/test_all_fk_simple.sql:160: NOTICE:  KEEP - improved by 70.78.2f%
psql:/tmp/test_all_fk_simple.sql:160: NOTICE:  
psql:/tmp/test_all_fk_simple.sql:160: NOTICE:  ========================================
psql:/tmp/test_all_fk_simple.sql:160: NOTICE:  Test 10/120: xhbm_automation_event_ids_ids.parent_automation_event_ids (216 kB)
psql:/tmp/test_all_fk_simple.sql:160: NOTICE:  ========================================
psql:/tmp/test_all_fk_simple.sql:160: NOTICE:  Baseline: 0.86500000000000000000.2f ms
psql:/tmp/test_all_fk_simple.sql:160: NOTICE:  Index created
psql:/tmp/test_all_fk_simple.sql:160: NOTICE:  With index: 0.48180000000000000000.2f ms
psql:/tmp/test_all_fk_simple.sql:160: NOTICE:  KEEP - improved by 44.30.2f%
psql:/tmp/test_all_fk_simple.sql:160: NOTICE:  
psql:/tmp/test_all_fk_simple.sql:160: NOTICE:  ========================================
psql:/tmp/test_all_fk_simple.sql:160: NOTICE:  Test 11/120: icr_roicollectiondata.subjectid (160 kB)
psql:/tmp/test_all_fk_simple.sql:160: NOTICE:  ========================================
psql:/tmp/test_all_fk_simple.sql:160: NOTICE:  Baseline: 1.3478000000000000.2f ms
psql:/tmp/test_all_fk_simple.sql:160: NOTICE:  Index created
psql:/tmp/test_all_fk_simple.sql:160: NOTICE:  With index: 0.48000000000000000000.2f ms
psql:/tmp/test_all_fk_simple.sql:160: NOTICE:  KEEP - improved by 64.39.2f%
psql:/tmp/test_all_fk_simple.sql:160: NOTICE:  
psql:/tmp/test_all_fk_simple.sql:160: NOTICE:  ========================================
psql:/tmp/test_all_fk_simple.sql:160: NOTICE:  Test 12/120: xhbm_configuration.config_data (160 kB)
psql:/tmp/test_all_fk_simple.sql:160: NOTICE:  ========================================
psql:/tmp/test_all_fk_simple.sql:160: NOTICE:  Baseline: 0.88200000000000000000.2f ms
psql:/tmp/test_all_fk_simple.sql:160: NOTICE:  Index created
psql:/tmp/test_all_fk_simple.sql:160: NOTICE:  With index: 0.47540000000000000000.2f ms
psql:/tmp/test_all_fk_simple.sql:160: NOTICE:  KEEP - improved by 46.10.2f%
psql:/tmp/test_all_fk_simple.sql:160: NOTICE:  
psql:/tmp/test_all_fk_simple.sql:160: NOTICE:  ========================================
psql:/tmp/test_all_fk_simple.sql:160: NOTICE:  Test 13/120: xnat_subjectassessordata.subject_id (120 kB)
psql:/tmp/test_all_fk_simple.sql:160: NOTICE:  ========================================
psql:/tmp/test_all_fk_simple.sql:160: NOTICE:  Baseline: 1.5998000000000000.2f ms
psql:/tmp/test_all_fk_simple.sql:160: NOTICE:  Index created
psql:/tmp/test_all_fk_simple.sql:160: NOTICE:  With index: 0.36980000000000000000.2f ms
psql:/tmp/test_all_fk_simple.sql:160: NOTICE:  KEEP - improved by 76.88.2f%
psql:/tmp/test_all_fk_simple.sql:160: NOTICE:  
psql:/tmp/test_all_fk_simple.sql:160: NOTICE:  ========================================
psql:/tmp/test_all_fk_simple.sql:160: NOTICE:  Test 14/120: xhbm_event_service_filter_entity_project_ids.event_service_filter_entity (112 kB)
psql:/tmp/test_all_fk_simple.sql:160: NOTICE:  ========================================
psql:/tmp/test_all_fk_simple.sql:160: NOTICE:  Baseline: 0.53120000000000000000.2f ms
psql:/tmp/test_all_fk_simple.sql:160: NOTICE:  Index created
psql:/tmp/test_all_fk_simple.sql:160: NOTICE:  With index: 0.43500000000000000000.2f ms
psql:/tmp/test_all_fk_simple.sql:160: NOTICE:  KEEP - improved by 18.11.2f%
psql:/tmp/test_all_fk_simple.sql:160: NOTICE:  
psql:/tmp/test_all_fk_simple.sql:160: NOTICE:  ========================================
psql:/tmp/test_all_fk_simple.sql:160: NOTICE:  Test 15/120: xnat_experimentdata_resource.xnat_abstractresource_xnat_abstractresource_id (104 kB)
psql:/tmp/test_all_fk_simple.sql:160: NOTICE:  ========================================
psql:/tmp/test_all_fk_simple.sql:160: NOTICE:  Baseline: 0.64760000000000000000.2f ms
psql:/tmp/test_all_fk_simple.sql:160: NOTICE:  Index created
psql:/tmp/test_all_fk_simple.sql:160: NOTICE:  With index: 0.28840000000000000000.2f ms
psql:/tmp/test_all_fk_simple.sql:160: NOTICE:  KEEP - improved by 55.47.2f%
psql:/tmp/test_all_fk_simple.sql:160: NOTICE:  
psql:/tmp/test_all_fk_simple.sql:160: NOTICE:  ========================================
psql:/tmp/test_all_fk_simple.sql:160: NOTICE:  Test 16/120: xnat_experimentdata_resource.xnat_experimentdata_id (104 kB)
psql:/tmp/test_all_fk_simple.sql:160: NOTICE:  ========================================
psql:/tmp/test_all_fk_simple.sql:160: NOTICE:  Baseline: 0.34880000000000000000.2f ms
psql:/tmp/test_all_fk_simple.sql:160: NOTICE:  Index created
psql:/tmp/test_all_fk_simple.sql:160: NOTICE:  With index: 0.24440000000000000000.2f ms
psql:/tmp/test_all_fk_simple.sql:160: NOTICE:  KEEP - improved by 29.93.2f%
psql:/tmp/test_all_fk_simple.sql:160: NOTICE:  
psql:/tmp/test_all_fk_simple.sql:160: NOTICE:  ========================================
psql:/tmp/test_all_fk_simple.sql:160: NOTICE:  Test 17/120: img_assessor_out_resource.xnat_abstractresource_xnat_abstractresource_id (72 kB)
psql:/tmp/test_all_fk_simple.sql:160: NOTICE:  ========================================
psql:/tmp/test_all_fk_simple.sql:160: NOTICE:  Baseline: 0.58600000000000000000.2f ms
psql:/tmp/test_all_fk_simple.sql:160: NOTICE:  Index created
psql:/tmp/test_all_fk_simple.sql:160: NOTICE:  With index: 0.22080000000000000000.2f ms
psql:/tmp/test_all_fk_simple.sql:160: NOTICE:  KEEP - improved by 62.32.2f%
psql:/tmp/test_all_fk_simple.sql:160: NOTICE:  
psql:/tmp/test_all_fk_simple.sql:160: NOTICE:  ========================================
psql:/tmp/test_all_fk_simple.sql:160: NOTICE:  Test 18/120: img_assessor_out_resource.xnat_imageassessordata_id (72 kB)
psql:/tmp/test_all_fk_simple.sql:160: NOTICE:  ========================================
psql:/tmp/test_all_fk_simple.sql:160: NOTICE:  Baseline: 0.31100000000000000000.2f ms
psql:/tmp/test_all_fk_simple.sql:160: NOTICE:  Index created
psql:/tmp/test_all_fk_simple.sql:160: NOTICE:  With index: 0.45200000000000000000.2f ms
psql:/tmp/test_all_fk_simple.sql:160: NOTICE:  ROLLBACK - only improved by -45.34.2f%
psql:/tmp/test_all_fk_simple.sql:160: NOTICE:  
psql:/tmp/test_all_fk_simple.sql:160: NOTICE:  ========================================
psql:/tmp/test_all_fk_simple.sql:160: NOTICE:  Test 19/120: xnat_imageassessordata.imagesession_id (40 kB)
psql:/tmp/test_all_fk_simple.sql:160: NOTICE:  ========================================
psql:/tmp/test_all_fk_simple.sql:160: NOTICE:  Baseline: 1.2536000000000000.2f ms
psql:/tmp/test_all_fk_simple.sql:160: NOTICE:  Index created
psql:/tmp/test_all_fk_simple.sql:160: NOTICE:  With index: 0.32660000000000000000.2f ms
psql:/tmp/test_all_fk_simple.sql:160: NOTICE:  KEEP - improved by 73.95.2f%
psql:/tmp/test_all_fk_simple.sql:160: NOTICE:  
psql:/tmp/test_all_fk_simple.sql:160: NOTICE:  ========================================
psql:/tmp/test_all_fk_simple.sql:160: NOTICE:  Test 20/120: xhbm_automation_filters_values.automation_filters (16 kB)
psql:/tmp/test_all_fk_simple.sql:160: NOTICE:  ========================================
psql:/tmp/test_all_fk_simple.sql:160: NOTICE:  Baseline: 0.36220000000000000000.2f ms
psql:/tmp/test_all_fk_simple.sql:160: NOTICE:  Index created
psql:/tmp/test_all_fk_simple.sql:160: NOTICE:  With index: 0.19040000000000000000.2f ms
psql:/tmp/test_all_fk_simple.sql:160: NOTICE:  KEEP - improved by 47.43.2f%
psql:/tmp/test_all_fk_simple.sql:160: NOTICE:  
DO
Time: 1777.361 ms (00:01.777)

=========================================
SUMMARY
=========================================

 tables_tested | indexes_tested | kept | rolled_back | errors | avg_improvement_pct 
---------------+----------------+------+-------------+--------+---------------------
            17 |             20 |   18 |           2 |      0 |               48.70
(1 row)

Time: 14.172 ms

--- KEPT INDEXES (>= 5% improvement) ---
                  table_name                  |   index_name   | improvement_pct 
----------------------------------------------+----------------+-----------------
 xhbm_container_entity                        | idx_test_fk_2  |           91.07
 xnat_subjectassessordata                     | idx_test_fk_13 |           76.88
 xnat_imageassessordata                       | idx_test_fk_19 |           73.95
 xnat_experimentdata                          | idx_test_fk_9  |           70.78
 icr_roicollectiondata                        | idx_test_fk_11 |           64.39
 img_assessor_out_resource                    | idx_test_fk_17 |           62.32
 xnat_experimentdata_resource                 | idx_test_fk_15 |           55.47
 xhbm_container_entity_history                | idx_test_fk_1  |           53.98
 xhbm_automation_filters_values               | idx_test_fk_20 |           47.43
 xhbm_configuration                           | idx_test_fk_12 |           46.10
 xhbm_automation_event_ids_ids                | idx_test_fk_10 |           44.30
 xhbm_subscription_delivery_entity            | idx_test_fk_7  |           35.17
 xhbm_container_entity_output                 | idx_test_fk_4  |           33.60
 xhbm_timed_event_status_entity               | idx_test_fk_6  |           30.38
 xnat_experimentdata_resource                 | idx_test_fk_16 |           29.93
 xhbm_container_entity_mount                  | idx_test_fk_3  |           23.06
 xhbm_container_entity_log_paths              | idx_test_fk_5  |           19.70
 xhbm_event_service_filter_entity_project_ids | idx_test_fk_14 |           18.11
(18 rows)

Time: 0.934 ms

--- ROLLED BACK (<5% improvement) ---
            table_name             |   index_name   | improvement_pct 
-----------------------------------+----------------+-----------------
 xhbm_subscription_delivery_entity | idx_test_fk_8  |          -40.49
 img_assessor_out_resource         | idx_test_fk_18 |          -45.34
(2 rows)

Time: 0.306 ms

--- ERRORS ---
 table_name | index_name | notes 
------------+------------+-------
(0 rows)

Time: 0.567 ms
psql:/tmp/test_all_fk_simple.sql:218: NOTICE:  Dropped: idx_test_fk_1
psql:/tmp/test_all_fk_simple.sql:218: NOTICE:  Dropped: idx_test_fk_10
psql:/tmp/test_all_fk_simple.sql:218: NOTICE:  Dropped: idx_test_fk_11
psql:/tmp/test_all_fk_simple.sql:218: NOTICE:  Dropped: idx_test_fk_12
psql:/tmp/test_all_fk_simple.sql:218: NOTICE:  Dropped: idx_test_fk_13
psql:/tmp/test_all_fk_simple.sql:218: NOTICE:  Dropped: idx_test_fk_14
psql:/tmp/test_all_fk_simple.sql:218: NOTICE:  Dropped: idx_test_fk_15
psql:/tmp/test_all_fk_simple.sql:218: NOTICE:  Dropped: idx_test_fk_16
psql:/tmp/test_all_fk_simple.sql:218: NOTICE:  Dropped: idx_test_fk_17
psql:/tmp/test_all_fk_simple.sql:218: NOTICE:  Dropped: idx_test_fk_19
psql:/tmp/test_all_fk_simple.sql:218: NOTICE:  Dropped: idx_test_fk_2
psql:/tmp/test_all_fk_simple.sql:218: NOTICE:  Dropped: idx_test_fk_20
psql:/tmp/test_all_fk_simple.sql:218: NOTICE:  Dropped: idx_test_fk_3
psql:/tmp/test_all_fk_simple.sql:218: NOTICE:  Dropped: idx_test_fk_4
psql:/tmp/test_all_fk_simple.sql:218: NOTICE:  Dropped: idx_test_fk_5
psql:/tmp/test_all_fk_simple.sql:218: NOTICE:  Dropped: idx_test_fk_6
psql:/tmp/test_all_fk_simple.sql:218: NOTICE:  Dropped: idx_test_fk_7
psql:/tmp/test_all_fk_simple.sql:218: NOTICE:  Dropped: idx_test_fk_9
DO
Time: 63.069 ms

All test indexes cleaned up
Results saved in pg_index_test_log table

