Timing is on.

=========================================
Simple FK Index Testing
=========================================

TRUNCATE TABLE
Time: 39.378 ms
CREATE FUNCTION
Time: 4.337 ms
Function created

psql:/tmp/test_all_fk_simple.sql:160: NOTICE:  Testing 120 foreign keys...
psql:/tmp/test_all_fk_simple.sql:160: NOTICE:  
psql:/tmp/test_all_fk_simple.sql:160: NOTICE:  ========================================
psql:/tmp/test_all_fk_simple.sql:160: NOTICE:  Test 1/120: xhbm_container_entity_history.container_entity (12 MB)
psql:/tmp/test_all_fk_simple.sql:160: NOTICE:  ========================================
psql:/tmp/test_all_fk_simple.sql:160: NOTICE:  Baseline: 11.6550000000000000.2f ms
psql:/tmp/test_all_fk_simple.sql:160: NOTICE:  Index created
psql:/tmp/test_all_fk_simple.sql:160: NOTICE:  With index: 5.7992000000000000.2f ms
psql:/tmp/test_all_fk_simple.sql:160: NOTICE:  KEEP - improved by 50.24.2f%
psql:/tmp/test_all_fk_simple.sql:160: NOTICE:  
psql:/tmp/test_all_fk_simple.sql:160: NOTICE:  ========================================
psql:/tmp/test_all_fk_simple.sql:160: NOTICE:  Test 2/120: xhbm_container_entity.parent_container_entity (5824 kB)
psql:/tmp/test_all_fk_simple.sql:160: NOTICE:  ========================================
psql:/tmp/test_all_fk_simple.sql:160: NOTICE:  Baseline: 5.8932000000000000.2f ms
psql:/tmp/test_all_fk_simple.sql:160: NOTICE:  Index created
psql:/tmp/test_all_fk_simple.sql:160: NOTICE:  With index: 0.29360000000000000000.2f ms
psql:/tmp/test_all_fk_simple.sql:160: NOTICE:  KEEP - improved by 95.02.2f%
psql:/tmp/test_all_fk_simple.sql:160: NOTICE:  
psql:/tmp/test_all_fk_simple.sql:160: NOTICE:  ========================================
psql:/tmp/test_all_fk_simple.sql:160: NOTICE:  Test 3/120: xhbm_container_entity_mount.container_entity (4952 kB)
psql:/tmp/test_all_fk_simple.sql:160: NOTICE:  ========================================
psql:/tmp/test_all_fk_simple.sql:160: NOTICE:  Baseline: 3.6182000000000000.2f ms
psql:/tmp/test_all_fk_simple.sql:160: NOTICE:  Index created
psql:/tmp/test_all_fk_simple.sql:160: NOTICE:  With index: 2.2926000000000000.2f ms
psql:/tmp/test_all_fk_simple.sql:160: NOTICE:  KEEP - improved by 36.64.2f%
psql:/tmp/test_all_fk_simple.sql:160: NOTICE:  
psql:/tmp/test_all_fk_simple.sql:160: NOTICE:  ========================================
psql:/tmp/test_all_fk_simple.sql:160: NOTICE:  Test 4/120: xhbm_container_entity_output.container_entity (2392 kB)
psql:/tmp/test_all_fk_simple.sql:160: NOTICE:  ========================================
psql:/tmp/test_all_fk_simple.sql:160: NOTICE:  Baseline: 2.5586000000000000.2f ms
psql:/tmp/test_all_fk_simple.sql:160: NOTICE:  Index created
psql:/tmp/test_all_fk_simple.sql:160: NOTICE:  With index: 1.3358000000000000.2f ms
psql:/tmp/test_all_fk_simple.sql:160: NOTICE:  KEEP - improved by 47.79.2f%
psql:/tmp/test_all_fk_simple.sql:160: NOTICE:  
psql:/tmp/test_all_fk_simple.sql:160: NOTICE:  ========================================
psql:/tmp/test_all_fk_simple.sql:160: NOTICE:  Test 5/120: xhbm_container_entity_log_paths.container_entity (1856 kB)
psql:/tmp/test_all_fk_simple.sql:160: NOTICE:  ========================================
psql:/tmp/test_all_fk_simple.sql:160: NOTICE:  Baseline: 1.4170000000000000.2f ms
psql:/tmp/test_all_fk_simple.sql:160: NOTICE:  Index created
psql:/tmp/test_all_fk_simple.sql:160: NOTICE:  With index: 1.2988000000000000.2f ms
psql:/tmp/test_all_fk_simple.sql:160: NOTICE:  KEEP - improved by 8.34.2f%
psql:/tmp/test_all_fk_simple.sql:160: NOTICE:  
psql:/tmp/test_all_fk_simple.sql:160: NOTICE:  ========================================
psql:/tmp/test_all_fk_simple.sql:160: NOTICE:  Test 6/120: xhbm_timed_event_status_entity.subscription_delivery_entity (488 kB)
psql:/tmp/test_all_fk_simple.sql:160: NOTICE:  ========================================
psql:/tmp/test_all_fk_simple.sql:160: NOTICE:  Baseline: 1.06620000000000000000.2f ms
psql:/tmp/test_all_fk_simple.sql:160: NOTICE:  Index created
psql:/tmp/test_all_fk_simple.sql:160: NOTICE:  With index: 0.76600000000000000000.2f ms
psql:/tmp/test_all_fk_simple.sql:160: NOTICE:  KEEP - improved by 28.16.2f%
psql:/tmp/test_all_fk_simple.sql:160: NOTICE:  
psql:/tmp/test_all_fk_simple.sql:160: NOTICE:  ========================================
psql:/tmp/test_all_fk_simple.sql:160: NOTICE:  Test 7/120: xhbm_subscription_delivery_entity.subscription (288 kB)
psql:/tmp/test_all_fk_simple.sql:160: NOTICE:  ========================================
psql:/tmp/test_all_fk_simple.sql:160: NOTICE:  Baseline: 0.64220000000000000000.2f ms
psql:/tmp/test_all_fk_simple.sql:160: NOTICE:  Index created
psql:/tmp/test_all_fk_simple.sql:160: NOTICE:  With index: 0.31040000000000000000.2f ms
psql:/tmp/test_all_fk_simple.sql:160: NOTICE:  KEEP - improved by 51.67.2f%
psql:/tmp/test_all_fk_simple.sql:160: NOTICE:  
psql:/tmp/test_all_fk_simple.sql:160: NOTICE:  ========================================
psql:/tmp/test_all_fk_simple.sql:160: NOTICE:  Test 8/120: xhbm_subscription_delivery_entity.triggering_event_entity (288 kB)
psql:/tmp/test_all_fk_simple.sql:160: NOTICE:  ========================================
psql:/tmp/test_all_fk_simple.sql:160: NOTICE:  Baseline: 0.81120000000000000000.2f ms
psql:/tmp/test_all_fk_simple.sql:160: NOTICE:  Index created
psql:/tmp/test_all_fk_simple.sql:160: NOTICE:  With index: 0.33940000000000000000.2f ms
psql:/tmp/test_all_fk_simple.sql:160: NOTICE:  KEEP - improved by 58.16.2f%
psql:/tmp/test_all_fk_simple.sql:160: NOTICE:  
psql:/tmp/test_all_fk_simple.sql:160: NOTICE:  ========================================
psql:/tmp/test_all_fk_simple.sql:160: NOTICE:  Test 9/120: xnat_experimentdata.visit (272 kB)
psql:/tmp/test_all_fk_simple.sql:160: NOTICE:  ========================================
psql:/tmp/test_all_fk_simple.sql:160: NOTICE:  Baseline: 1.5670000000000000.2f ms
psql:/tmp/test_all_fk_simple.sql:160: NOTICE:  Index created
psql:/tmp/test_all_fk_simple.sql:160: NOTICE:  With index: 0.28480000000000000000.2f ms
psql:/tmp/test_all_fk_simple.sql:160: NOTICE:  KEEP - improved by 81.83.2f%
psql:/tmp/test_all_fk_simple.sql:160: NOTICE:  
psql:/tmp/test_all_fk_simple.sql:160: NOTICE:  ========================================
psql:/tmp/test_all_fk_simple.sql:160: NOTICE:  Test 10/120: xhbm_automation_event_ids_ids.parent_automation_event_ids (216 kB)
psql:/tmp/test_all_fk_simple.sql:160: NOTICE:  ========================================
psql:/tmp/test_all_fk_simple.sql:160: NOTICE:  Baseline: 0.50560000000000000000.2f ms
psql:/tmp/test_all_fk_simple.sql:160: NOTICE:  Index created
psql:/tmp/test_all_fk_simple.sql:160: NOTICE:  With index: 0.37120000000000000000.2f ms
psql:/tmp/test_all_fk_simple.sql:160: NOTICE:  KEEP - improved by 26.58.2f%
psql:/tmp/test_all_fk_simple.sql:160: NOTICE:  
psql:/tmp/test_all_fk_simple.sql:160: NOTICE:  ========================================
psql:/tmp/test_all_fk_simple.sql:160: NOTICE:  Test 11/120: icr_roicollectiondata.subjectid (160 kB)
psql:/tmp/test_all_fk_simple.sql:160: NOTICE:  ========================================
psql:/tmp/test_all_fk_simple.sql:160: NOTICE:  Baseline: 0.87400000000000000000.2f ms
psql:/tmp/test_all_fk_simple.sql:160: NOTICE:  Index created
psql:/tmp/test_all_fk_simple.sql:160: NOTICE:  With index: 0.21120000000000000000.2f ms
psql:/tmp/test_all_fk_simple.sql:160: NOTICE:  KEEP - improved by 75.84.2f%
psql:/tmp/test_all_fk_simple.sql:160: NOTICE:  
psql:/tmp/test_all_fk_simple.sql:160: NOTICE:  ========================================
psql:/tmp/test_all_fk_simple.sql:160: NOTICE:  Test 12/120: xhbm_configuration.config_data (160 kB)
psql:/tmp/test_all_fk_simple.sql:160: NOTICE:  ========================================
psql:/tmp/test_all_fk_simple.sql:160: NOTICE:  Baseline: 0.40600000000000000000.2f ms
psql:/tmp/test_all_fk_simple.sql:160: NOTICE:  Index created
psql:/tmp/test_all_fk_simple.sql:160: NOTICE:  With index: 0.27600000000000000000.2f ms
psql:/tmp/test_all_fk_simple.sql:160: NOTICE:  KEEP - improved by 32.02.2f%
psql:/tmp/test_all_fk_simple.sql:160: NOTICE:  
psql:/tmp/test_all_fk_simple.sql:160: NOTICE:  ========================================
psql:/tmp/test_all_fk_simple.sql:160: NOTICE:  Test 13/120: xnat_subjectassessordata.subject_id (120 kB)
psql:/tmp/test_all_fk_simple.sql:160: NOTICE:  ========================================
psql:/tmp/test_all_fk_simple.sql:160: NOTICE:  Baseline: 0.78280000000000000000.2f ms
psql:/tmp/test_all_fk_simple.sql:160: NOTICE:  Index created
psql:/tmp/test_all_fk_simple.sql:160: NOTICE:  With index: 0.32420000000000000000.2f ms
psql:/tmp/test_all_fk_simple.sql:160: NOTICE:  KEEP - improved by 58.58.2f%
psql:/tmp/test_all_fk_simple.sql:160: NOTICE:  
psql:/tmp/test_all_fk_simple.sql:160: NOTICE:  ========================================
psql:/tmp/test_all_fk_simple.sql:160: NOTICE:  Test 14/120: xhbm_event_service_filter_entity_project_ids.event_service_filter_entity (112 kB)
psql:/tmp/test_all_fk_simple.sql:160: NOTICE:  ========================================
psql:/tmp/test_all_fk_simple.sql:160: NOTICE:  Baseline: 0.36260000000000000000.2f ms
psql:/tmp/test_all_fk_simple.sql:160: NOTICE:  Index created
psql:/tmp/test_all_fk_simple.sql:160: NOTICE:  With index: 0.30000000000000000000.2f ms
psql:/tmp/test_all_fk_simple.sql:160: NOTICE:  KEEP - improved by 17.26.2f%
psql:/tmp/test_all_fk_simple.sql:160: NOTICE:  
psql:/tmp/test_all_fk_simple.sql:160: NOTICE:  ========================================
psql:/tmp/test_all_fk_simple.sql:160: NOTICE:  Test 15/120: xnat_experimentdata_resource.xnat_abstractresource_xnat_abstractresource_id (104 kB)
psql:/tmp/test_all_fk_simple.sql:160: NOTICE:  ========================================
psql:/tmp/test_all_fk_simple.sql:160: NOTICE:  Baseline: 0.48120000000000000000.2f ms
psql:/tmp/test_all_fk_simple.sql:160: NOTICE:  Index created
psql:/tmp/test_all_fk_simple.sql:160: NOTICE:  With index: 0.30240000000000000000.2f ms
psql:/tmp/test_all_fk_simple.sql:160: NOTICE:  KEEP - improved by 37.16.2f%
psql:/tmp/test_all_fk_simple.sql:160: NOTICE:  
psql:/tmp/test_all_fk_simple.sql:160: NOTICE:  ========================================
psql:/tmp/test_all_fk_simple.sql:160: NOTICE:  Test 16/120: xnat_experimentdata_resource.xnat_experimentdata_id (104 kB)
psql:/tmp/test_all_fk_simple.sql:160: NOTICE:  ========================================
psql:/tmp/test_all_fk_simple.sql:160: NOTICE:  Baseline: 0.22240000000000000000.2f ms
psql:/tmp/test_all_fk_simple.sql:160: NOTICE:  Index created
psql:/tmp/test_all_fk_simple.sql:160: NOTICE:  With index: 0.28900000000000000000.2f ms
psql:/tmp/test_all_fk_simple.sql:160: NOTICE:  ROLLBACK - only improved by -29.95.2f%
psql:/tmp/test_all_fk_simple.sql:160: NOTICE:  
psql:/tmp/test_all_fk_simple.sql:160: NOTICE:  ========================================
psql:/tmp/test_all_fk_simple.sql:160: NOTICE:  Test 17/120: img_assessor_out_resource.xnat_abstractresource_xnat_abstractresource_id (72 kB)
psql:/tmp/test_all_fk_simple.sql:160: NOTICE:  ========================================
psql:/tmp/test_all_fk_simple.sql:160: NOTICE:  Baseline: 0.41000000000000000000.2f ms
psql:/tmp/test_all_fk_simple.sql:160: NOTICE:  Index created
psql:/tmp/test_all_fk_simple.sql:160: NOTICE:  With index: 0.23640000000000000000.2f ms
psql:/tmp/test_all_fk_simple.sql:160: NOTICE:  KEEP - improved by 42.34.2f%
psql:/tmp/test_all_fk_simple.sql:160: NOTICE:  
psql:/tmp/test_all_fk_simple.sql:160: NOTICE:  ========================================
psql:/tmp/test_all_fk_simple.sql:160: NOTICE:  Test 18/120: img_assessor_out_resource.xnat_imageassessordata_id (72 kB)
psql:/tmp/test_all_fk_simple.sql:160: NOTICE:  ========================================
psql:/tmp/test_all_fk_simple.sql:160: NOTICE:  Baseline: 0.18360000000000000000.2f ms
psql:/tmp/test_all_fk_simple.sql:160: NOTICE:  Index created
psql:/tmp/test_all_fk_simple.sql:160: NOTICE:  With index: 0.28340000000000000000.2f ms
psql:/tmp/test_all_fk_simple.sql:160: NOTICE:  ROLLBACK - only improved by -54.36.2f%
psql:/tmp/test_all_fk_simple.sql:160: NOTICE:  
psql:/tmp/test_all_fk_simple.sql:160: NOTICE:  ========================================
psql:/tmp/test_all_fk_simple.sql:160: NOTICE:  Test 19/120: xnat_imageassessordata.imagesession_id (40 kB)
psql:/tmp/test_all_fk_simple.sql:160: NOTICE:  ========================================
psql:/tmp/test_all_fk_simple.sql:160: NOTICE:  Baseline: 4.3840000000000000.2f ms
psql:/tmp/test_all_fk_simple.sql:160: NOTICE:  Index created
psql:/tmp/test_all_fk_simple.sql:160: NOTICE:  With index: 0.24280000000000000000.2f ms
psql:/tmp/test_all_fk_simple.sql:160: NOTICE:  KEEP - improved by 94.46.2f%
psql:/tmp/test_all_fk_simple.sql:160: NOTICE:  
psql:/tmp/test_all_fk_simple.sql:160: NOTICE:  ========================================
psql:/tmp/test_all_fk_simple.sql:160: NOTICE:  Test 20/120: xhbm_automation_filters_values.automation_filters (16 kB)
psql:/tmp/test_all_fk_simple.sql:160: NOTICE:  ========================================
psql:/tmp/test_all_fk_simple.sql:160: NOTICE:  Baseline: 0.27980000000000000000.2f ms
psql:/tmp/test_all_fk_simple.sql:160: NOTICE:  Index created
psql:/tmp/test_all_fk_simple.sql:160: NOTICE:  With index: 0.20480000000000000000.2f ms
psql:/tmp/test_all_fk_simple.sql:160: NOTICE:  KEEP - improved by 26.80.2f%
psql:/tmp/test_all_fk_simple.sql:160: NOTICE:  
DO
Time: 1471.270 ms (00:01.471)

=========================================
SUMMARY
=========================================

 tables_tested | indexes_tested | kept | rolled_back | errors | avg_improvement_pct 
---------------+----------------+------+-------------+--------+---------------------
            17 |             20 |   18 |           2 |      0 |               48.27
(1 row)

Time: 14.848 ms

--- KEPT INDEXES (>= 5% improvement) ---
                  table_name                  |   index_name   | improvement_pct 
----------------------------------------------+----------------+-----------------
 xhbm_container_entity                        | idx_test_fk_2  |           95.02
 xnat_imageassessordata                       | idx_test_fk_19 |           94.46
 xnat_experimentdata                          | idx_test_fk_9  |           81.83
 icr_roicollectiondata                        | idx_test_fk_11 |           75.84
 xnat_subjectassessordata                     | idx_test_fk_13 |           58.58
 xhbm_subscription_delivery_entity            | idx_test_fk_8  |           58.16
 xhbm_subscription_delivery_entity            | idx_test_fk_7  |           51.67
 xhbm_container_entity_history                | idx_test_fk_1  |           50.24
 xhbm_container_entity_output                 | idx_test_fk_4  |           47.79
 img_assessor_out_resource                    | idx_test_fk_17 |           42.34
 xnat_experimentdata_resource                 | idx_test_fk_15 |           37.16
 xhbm_container_entity_mount                  | idx_test_fk_3  |           36.64
 xhbm_configuration                           | idx_test_fk_12 |           32.02
 xhbm_timed_event_status_entity               | idx_test_fk_6  |           28.16
 xhbm_automation_filters_values               | idx_test_fk_20 |           26.80
 xhbm_automation_event_ids_ids                | idx_test_fk_10 |           26.58
 xhbm_event_service_filter_entity_project_ids | idx_test_fk_14 |           17.26
 xhbm_container_entity_log_paths              | idx_test_fk_5  |            8.34
(18 rows)

Time: 0.899 ms

--- ROLLED BACK (<5% improvement) ---
          table_name          |   index_name   | improvement_pct 
------------------------------+----------------+-----------------
 xnat_experimentdata_resource | idx_test_fk_16 |          -29.95
 img_assessor_out_resource    | idx_test_fk_18 |          -54.36
(2 rows)

Time: 0.456 ms

--- ERRORS ---
 table_name | index_name | notes 
------------+------------+-------
(0 rows)

Time: 0.181 ms
psql:/tmp/test_all_fk_simple.sql:218: NOTICE:  Dropped: idx_test_fk_1
psql:/tmp/test_all_fk_simple.sql:218: NOTICE:  Dropped: idx_test_fk_10
psql:/tmp/test_all_fk_simple.sql:218: NOTICE:  Dropped: idx_test_fk_11
psql:/tmp/test_all_fk_simple.sql:218: NOTICE:  Dropped: idx_test_fk_12
psql:/tmp/test_all_fk_simple.sql:218: NOTICE:  Dropped: idx_test_fk_13
psql:/tmp/test_all_fk_simple.sql:218: NOTICE:  Dropped: idx_test_fk_14
psql:/tmp/test_all_fk_simple.sql:218: NOTICE:  Dropped: idx_test_fk_15
psql:/tmp/test_all_fk_simple.sql:218: NOTICE:  Dropped: idx_test_fk_17
psql:/tmp/test_all_fk_simple.sql:218: NOTICE:  Dropped: idx_test_fk_19
psql:/tmp/test_all_fk_simple.sql:218: NOTICE:  Dropped: idx_test_fk_2
psql:/tmp/test_all_fk_simple.sql:218: NOTICE:  Dropped: idx_test_fk_20
psql:/tmp/test_all_fk_simple.sql:218: NOTICE:  Dropped: idx_test_fk_3
psql:/tmp/test_all_fk_simple.sql:218: NOTICE:  Dropped: idx_test_fk_4
psql:/tmp/test_all_fk_simple.sql:218: NOTICE:  Dropped: idx_test_fk_5
psql:/tmp/test_all_fk_simple.sql:218: NOTICE:  Dropped: idx_test_fk_6
psql:/tmp/test_all_fk_simple.sql:218: NOTICE:  Dropped: idx_test_fk_7
psql:/tmp/test_all_fk_simple.sql:218: NOTICE:  Dropped: idx_test_fk_8
psql:/tmp/test_all_fk_simple.sql:218: NOTICE:  Dropped: idx_test_fk_9
DO
Time: 36.952 ms

All test indexes cleaned up
Results saved in pg_index_test_log table

